### ISSUE TITLE
Can't build SCTP connection

### ISSUE THREAD

**Issue by lxlenovostar** [sctplab/usrsctp#431]
I run `client `on Ubuntu 16.04 in VirtualBox. And I run `discard_server `on CentOS which have public IP. 

```
./discard_server 11111 22222
./client 15.23.24.64  9 0 22222 11111
```
I get the packets on 15.23.24.64:
```
tcpdump -i eth0 udp port 11111
tcpdump: verbose output suppressed, use -v or -vv for full protocol decode
listening on eth0, link-type EN10MB (Ethernet), capture size 65535 bytes
20:54:00.423386 IP 211.97.131.223.62406 > 15.23.24.64.vce: UDP, length 112
20:54:00.423637 IP 15.23.24.64.vce > 211.97.131.223.62406: UDP, length 432
20:54:03.728221 IP 211.97.131.223.62406 > 15.23.24.64.vce: UDP, length 112
20:54:03.728364 IP 15.23.24.64.vce > 211.97.131.223.62406: UDP, length 432
```

My network configuration on Ubuntu is:

```
docker0   Link encap:Ethernet  HWaddr 02:42:2a:e3:cb:09  
          inet addr:172.17.0.1  Bcast:172.17.255.255  Mask:255.255.0.0
          UP BROADCAST MULTICAST  MTU:1500  Metric:1
          RX packets:0 errors:0 dropped:0 overruns:0 frame:0
          TX packets:0 errors:0 dropped:0 overruns:0 carrier:0
          collisions:0 txqueuelen:0 
          RX bytes:0 (0.0 B)  TX bytes:0 (0.0 B)

enp0s3    Link encap:Ethernet  HWaddr 08:00:27:55:5f:76  
          inet addr:10.0.2.15  Bcast:10.0.2.255  Mask:255.255.255.0
          inet6 addr: fe80::24c8:9fee:ea66:2c85/64 Scope:Link
          UP BROADCAST RUNNING MULTICAST  MTU:1500  Metric:1
          RX packets:16998 errors:0 dropped:0 overruns:0 frame:0
          TX packets:6643 errors:0 dropped:0 overruns:0 carrier:0
          collisions:0 txqueuelen:1000 
          RX bytes:20229876 (20.2 MB)  TX bytes:476412 (476.4 KB)

lo        Link encap:Local Loopback  
          inet addr:127.0.0.1  Mask:255.0.0.0
          inet6 addr: ::1/128 Scope:Host
          UP LOOPBACK RUNNING  MTU:65536  Metric:1
          RX packets:427 errors:0 dropped:0 overruns:0 frame:0
          TX packets:427 errors:0 dropped:0 overruns:0 carrier:0
          collisions:0 txqueuelen:1 
          RX bytes:32040 (32.0 KB)  TX bytes:32040 (32.0 KB)
```

How to find Why can't build SCTP connection?  Call `usrsctp_dumppacket `or other?
Thank you.

**Comment by lxlenovostar** [comment]
The log of `client.c ` is:
![thread2](https://user-images.githubusercontent.com/444868/75236975-8cdd2d80-57f9-11ea-8a68-0dd2b34de041.jpg)

I find `sctp_findassociation_special_addr` can't get the `stcb`. 
![thread](https://user-images.githubusercontent.com/444868/75236511-dc6f2980-57f8-11ea-92b9-c490bf0207af.jpg)

And the pcap file is:
[sctp.zip](https://github.com/sctplab/usrsctp/files/4249309/sctp.zip)
