### ISSUE TITLE
How to disable local IP announcement?

### ISSUE THREAD

**Issue by cukiernick** [sctplab/usrsctp#525]
Hi,
I am trying to modify `programs/client.c` not to announce all the local IPs.
According to [RFC6458#section-4.1.2](https://tools.ietf.org/html/rfc6458#section-4.1.2) it should be enough to call `usrsctp_bind` on socket before connect (at least this is how I understand this rfc), but it seems that bind is completely ignored.

Snip from modified client.c:
```c
	usrsctp_init(0, NULL, debug_printf_stack);
	usrsctp_sysctl_set_sctp_debug_on(0x7ff3ffff);
	usrsctp_sysctl_set_sctp_auto_asconf(0);

	if ((sock = usrsctp_socket(AF_INET, SOCK_STREAM, IPPROTO_SCTP, NULL, NULL, 0, NULL)) == NULL) {
		perror("usrsctp_socket");
	}

	memset((void *)&addr4, 0, sizeof(struct sockaddr_in));
	addr4.sin_family = AF_INET;
	addr4.sin_port = htons(atoi(argv[2]));

	struct sockaddr_in6 local_sockaddr;
	memset((void *)&local_sockaddr, 0, sizeof(struct sockaddr_in6));
	local_sockaddr.sin6_family = AF_INET;
	inet_pton(AF_INET, "192.168.101.66", &local_sockaddr.sin6_addr);
	int returned;
	returned = usrsctp_bind(sock, (struct sockaddr *)&local_sockaddr, sizeof(local_sockaddr));
	printf("bind:%i\n", returned);

	if (inet_pton(AF_INET, argv[1], &addr4.sin_addr) == 1) {
		if (usrsctp_connect(sock, (struct sockaddr *)&addr4, sizeof(struct sockaddr_in)) < 0) {
			perror("usrsctp_connect");
		}
	} else {
		printf("Illegal destination address.\n");
	}
	[...]
```

program output (connecting to echo_server):
```
# ./client 192.168.101.67 7
[S][0.000] Timer type 7 started: ticks=3600000, inp=0x55b3f68af840, stcb=(nil), net=(nil).
[S][0.000] SCTP: add HMAC id 1 to list
[S][0.000] SCTP: added chunk 193 (0xc1) to Auth list
[S][0.000] SCTP: added chunk 128 (0x80) to Auth list
[S][0.000] Bind called port: 0
[S][0.000] Addr: [S][0.001] IPv4 address: 0.0.0.0:0
[S][0.001] Main hash to bind at head:0x55b3f68aaa68, bound port:65464 - in tcp_pool=0
bind:0
[S][0.001] Allocate an association for peer:[S][0.001] IPv4 address: 192.168.101.67:7
[S][0.001] Port:7
[S][0.002] Adding an address (from:1) to the peer: [S][0.002] IPv4 address: 192.168.101.67:7
[S][0.002] Association 0x55b3f68b0910 now allocated
[S][0.002] Sending INIT
[S][0.002] Timer type 2 started: ticks=3000, inp=0x55b3f68af840, stcb=0x55b3f68b0910, net=0x55b3f68b1460.
[S][0.002] Sending INIT - calls lowlevel_output
[S][0.002] Select source addr for:[S][0.002] IPv4 address: 192.168.101.67:7
[S][0.002] ifn from route:(nil) ifn_index:1
[S][0.002] ifn_index:1 name:lo is emit interface
[S][0.002] Is destination preferred:[S][0.002] IPv4 address: 106.106.106.106:0
[S][0.002] src_loop:1 src_priv:0 src_glob:0
[S][0.002] dest_loop:0 dest_priv:1 dest_glob:0
[S][0.002] NO:4
[S][0.002] Is destination preferred:[S][0.002] IPv4 address: 127.0.0.1:0
[S][0.002] src_loop:1 src_priv:0 src_glob:0
[S][0.002] dest_loop:0 dest_priv:1 dest_glob:0
[S][0.002] NO:4
[S][0.002] Found 0 preferred source addresses for intf:lo
[S][0.002] Trying Plan B
[S][0.002] Examine interface enp0s8
[S][0.002] Is destination preferred:[S][0.002] IPv4 address: 192.168.101.65:0
[S][0.002] src_loop:0 src_priv:1 src_glob:0
[S][0.002] dest_loop:0 dest_priv:1 dest_glob:0
[S][0.002] YES
[S][0.002] Is destination preferred:[S][0.002] IPv4 address: 192.168.101.66:0
[S][0.002] src_loop:0 src_priv:1 src_glob:0
[S][0.002] dest_loop:0 dest_priv:1 dest_glob:0
[S][0.002] YES
[S][0.002] Found ifn:(nil) 2 preferred source addresses
[S][0.002] num preferred:2 on interface:0x55b3f68ae700 cur_addr_num:0
[S][0.002] Is destination preferred:[S][0.002] IPv4 address: 192.168.101.65:0
[S][0.002] src_loop:0 src_priv:1 src_glob:0
[S][0.002] dest_loop:0 dest_priv:1 dest_glob:0
[S][0.002] YES
[S][0.002] we selected 0
[S][0.002] Source:[S][0.002] IPv4 address: 192.168.101.65:0
[S][0.002] Dest:[S][0.002] IPv4 address: 192.168.101.67:7
[S][0.002] Calling ipv4 output routine from low level src addr:c0a86541
[S][0.002] Destination is c0a86543
[S][0.002] RTP route is 0x55b3f68b08c0 through
[S][0.003] IP output returns 0
[S][0.003] Ok, Common input processing called, m:0x7fad54000f30 iphlen:20 offset:32 length:508 stcb:0x55b3f68b0910
[S][0.004] stcb:0x55b3f68b0910 state:2
[S][0.004] sctp_process_control: iphlen=20, offset=32, length=508 stcb:0x55b3f68b0910
[S][0.004] sctp_process_control: processing a chunk type=2, len=476
[S][0.004] SCTP_INIT_ACK
[S][0.004] sctp_handle_init_ack: handling INIT-ACK
[S][0.004] Check for unrecognized param's
[S][0.004] Hit default param 8004
[S][0.004] move on
[S][0.005] SCTP: add HMAC id 1 to list
[S][0.005] SCTP: added chunk 128 (0x80) to Auth list
[S][0.005] SCTP: added chunk 193 (0xc1) to Auth list
[S][0.005] Adding an address (from:4) to the peer: [S][0.005] IPv4 address: 10.0.2.15:7
[S][0.005] SCTP: negotiated peer HMAC id 1
[S][0.005] Timer type 2 stopped: inp=0x55b3f68af840, stcb=0x55b3f68b0910, net=0x55b3f68b1460.
[S][0.005] moving to COOKIE-ECHOED state
[S][0.006] Timer type 6 started: ticks=1000, inp=0x55b3f68af840, stcb=0x55b3f68b0910, net=0x55b3f68b1460.
[S][0.006] Leaving handle-init-ack end
[S][0.006] Timer type 6 already running: inp=0x55b3f68af840, stcb=0x55b3f68b0910, net=0x55b3f68b1460.
[S][0.006] Calling ipv4 output routine from low level src addr:c0a86541
[S][0.006] Destination is c0a86543
[S][0.006] RTP route is 0x55b3f68b08c0 through
[S][0.007] IP output returns 0
[S][0.007] m-c-o put out 0
[S][0.007] Ok, we have put out 0 chunks
[S][0.007] Check for chunk output prw:131072 tqe:0 tf=0
[S][0.007] Calling chunk OUTPUT
[S][0.007] m-c-o put out 0
[S][0.007] Ok, we have put out 0 chunks
[S][0.007] chunk OUTPUT returns
[S][0.007] Ok, Common input processing called, m:0x7fad54000f30 iphlen:20 offset:32 length:36 stcb:0x55b3f68b0910
[S][0.007] stcb:0x55b3f68b0910 state:4
[S][0.007] sctp_process_control: iphlen=20, offset=32, length=36 stcb:0x55b3f68b0910
[S][0.007] sctp_process_control: processing a chunk type=11, len=4
[S][0.007] SCTP_COOKIE_ACK, stcb 0x55b3f68b0910
[S][0.007] sctp_handle_cookie_ack: handling COOKIE-ACK
[S][0.007] Timer type 6 stopped: inp=0x55b3f68af840, stcb=0x55b3f68b0910, net=0x55b3f68b1460.
[S][0.007] moving to OPEN state
[S][0.007] Timer type 8 started: ticks=600000, inp=0x55b3f68af840, stcb=0x55b3f68b0910, net=0x55b3f68b1460.
[S][0.007] Timer type 5 started: ticks=31454, inp=0x55b3f68af840, stcb=0x55b3f68b0910, net=0x55b3f68b1460.
[S][0.007] Timer type 8 started: ticks=600000, inp=0x55b3f68af840, stcb=0x55b3f68b0910, net=0x7fad5404b200.
[S][0.007] Timer type 5 started: ticks=3208, inp=0x55b3f68af840, stcb=0x55b3f68b0910, net=0x7fad5404b200.
[S][0.007] Select source addr for:[S][0.007] IPv4 address: 10.0.2.15:7
[S][0.007] ifn from route:(nil) ifn_index:1
[S][0.007] ifn_index:1 name:lo is emit interface
[S][0.007] Is destination preferred:[S][0.007] IPv4 address: 106.106.106.106:0
[S][0.007] src_loop:1 src_priv:0 src_glob:0
[S][0.007] dest_loop:0 dest_priv:1 dest_glob:0
[S][0.007] NO:4
[S][0.007] Is destination preferred:[S][0.007] IPv4 address: 127.0.0.1:0
[S][0.007] src_loop:1 src_priv:0 src_glob:0
[S][0.007] dest_loop:0 dest_priv:1 dest_glob:0
[S][0.007] NO:4
[S][0.007] Found 0 preferred source addresses for intf:lo
[S][0.007] Trying Plan B
[S][0.007] Examine interface enp0s8
[S][0.007] Is destination preferred:[S][0.007] IPv4 address: 192.168.101.65:0
[S][0.007] src_loop:0 src_priv:1 src_glob:0
[S][0.007] dest_loop:0 dest_priv:1 dest_glob:0
[S][0.007] YES
[S][0.007] Is destination preferred:[S][0.007] IPv4 address: 192.168.101.66:0
[S][0.007] src_loop:0 src_priv:1 src_glob:0
[S][0.007] dest_loop:0 dest_priv:1 dest_glob:0
[S][0.007] YES
[S][0.007] Found ifn:(nil) 2 preferred source addresses
[S][0.007] num preferred:2 on interface:0x55b3f68ae700 cur_addr_num:0
[S][0.007] Is destination preferred:[S][0.007] IPv4 address: 192.168.101.65:0
[S][0.007] src_loop:0 src_priv:1 src_glob:0
[S][0.007] dest_loop:0 dest_priv:1 dest_glob:0
[S][0.007] YES
[S][0.007] we selected 0
[S][0.008] Source:[S][0.008] IPv4 address: 192.168.101.65:0
[S][0.008] Dest:[S][0.008] IPv4 address: 10.0.2.15:7
[S][0.008] Calling ipv4 output routine from low level src addr:c0a86541
[S][0.008] Destination is a00020f
[S][0.008] RTP route is 0x7fad5404b480 through
[S][0.008] IP output returns 0
[S][0.008] m-c-o put out 1
[S][0.008] Ok, we have put out 1 chunks
[S][0.008] Timer type 5 already running: inp=0x55b3f68af840, stcb=0x55b3f68b0910, net=0x55b3f68b1460.
[S][0.008] Check for chunk output prw:131072 tqe:1 tf=0
Local addresses: 192.168.101.65, 192.168.101.66, 10.0.2.16.
Peer addresses: 192.168.101.67, 10.0.2.15.
[S][0.008] Ok, Common input processing called, m:0x7fad54000f30 iphlen:20 offset:32 length:76 stcb:0x55b3f68b0910
[S][0.008] stcb:0x55b3f68b0910 state:8
[S][0.008] sctp_process_control: iphlen=20, offset=32, length=76 stcb:0x55b3f68b0910
[S][0.008] sctp_process_control: processing a chunk type=4, len=44
[S][0.008] SCTP_HEARTBEAT
[S][0.008] Check for chunk output prw:131072 tqe:0 tf=0
[S][0.008] Calling chunk OUTPUT
[S][0.008] Calling ipv4 output routine from low level src addr:c0a86541
[S][0.008] Destination is c0a86543
[S][0.008] RTP route is 0x55b3f68b08c0 through
[S][0.008] IP output returns 0
[S][0.008] m-c-o put out 1
[S][0.008] Ok, we have put out 1 chunks
[S][0.008] chunk OUTPUT returns
[S][3.266] Timer type 5 goes off.
[S][3.266] Error count for 0x7fad5404b200 now 1 thresh:5
[S][3.266] Overall error count for 0x55b3f68b0968 now 0 thresh:10 state:201
[S][3.267] Timer type 5 started: ticks=6629, inp=0x55b3f68af840, stcb=0x55b3f68b0910, net=0x7fad5404b200.
[S][3.267] Timer type 5 handler finished.
DONE, usrsctp shutdown[S][3.377] Timer type 3 not stopped: inp=0x55b3f68af840, stcb=0x55b3f68b0910, net=(nil).
[S][3.377] Timer type 13 not stopped: inp=0x55b3f68af840, stcb=0x55b3f68b0910, net=(nil).
[S][3.377] Timer type 10 not stopped: inp=0x55b3f68af840, stcb=0x55b3f68b0910, net=(nil).
[S][3.377] Timer type 12 not stopped: inp=0x55b3f68af840, stcb=0x55b3f68b0910, net=(nil).
[S][3.377] Timer type 8 stopped: inp=0x55b3f68af840, stcb=0x55b3f68b0910, net=0x55b3f68b1460.
[S][3.377] Timer type 5 stopped: inp=0x55b3f68af840, stcb=0x55b3f68b0910, net=0x55b3f68b1460.
[S][3.377] Timer type 8 stopped: inp=0x55b3f68af840, stcb=0x55b3f68b0910, net=0x7fad5404b200.
[S][3.377] Timer type 5 stopped: inp=0x55b3f68af840, stcb=0x55b3f68b0910, net=0x7fad5404b200.
[S][3.377] Timer type 4 started: ticks=1000, inp=0x55b3f68af840, stcb=0x55b3f68b0910, net=0x55b3f68b1460.
[S][3.377] Timer type 11 started: ticks=300000, inp=0x55b3f68af840, stcb=0x55b3f68b0910, net=(nil).
[S][3.377] Calling ipv4 output routine from low level src addr:c0a86541
[S][3.377] Destination is c0a86543
[S][3.377] RTP route is 0x55b3f68b08c0 through
[S][3.377] IP output returns 0
[S][3.377] m-c-o put out 1
[S][3.377] Ok, we have put out 1 chunks
[S][3.377] Ok, Common input processing called, m:0x7fad54000f30 iphlen:20 offset:32 length:36 stcb:0x55b3f68b0910
[S][3.377] stcb:0x55b3f68b0910 state:10
[S][3.377] sctp_process_control: iphlen=20, offset=32, length=36 stcb:0x55b3f68b0910
[S][3.377] sctp_process_control: processing a chunk type=8, len=4
[S][3.377] SCTP_SHUTDOWN_ACK, stcb 0x55b3f68b0910
[S][3.377] sctp_handle_shutdown_ack: handling SHUTDOWN ACK
[S][3.377] Timer type 4 stopped: inp=0x55b3f68af840, stcb=0x55b3f68b0910, net=0x55b3f68b1460.
[S][3.377] Calling ipv4 output routine from low level src addr:c0a86541
[S][3.377] Destination is c0a86543
[S][3.377] RTP route is 0x55b3f68b08c0 through
[S][3.377] IP output returns 0
Receive callback[S][3.377] Timer type 3 not stopped: inp=0x55b3f68af840, stcb=0x55b3f68b0910, net=(nil).
[S][3.377] Timer type 13 not stopped: inp=0x55b3f68af840, stcb=0x55b3f68b0910, net=(nil).
[S][3.377] Timer type 10 not stopped: inp=0x55b3f68af840, stcb=0x55b3f68b0910, net=(nil).
[S][3.377] Timer type 12 not stopped: inp=0x55b3f68af840, stcb=0x55b3f68b0910, net=(nil).
[S][3.377] Timer type 11 stopped: inp=0x55b3f68af840, stcb=0x55b3f68b0910, net=(nil).
[S][3.377] Timer type 17 not stopped: inp=0x55b3f68af840, stcb=0x55b3f68b0910, net=(nil).
[S][3.377] Shared timer type 1 not running: inp=0x55b3f68af840, stcb=0x55b3f68b0910, net=0x55b3f68b1460.
[S][3.377] Shared timer type 2 not running: inp=0x55b3f68af840, stcb=0x55b3f68b0910, net=0x55b3f68b1460.
[S][3.377] Timer type 4 not stopped: inp=0x55b3f68af840, stcb=0x55b3f68b0910, net=0x55b3f68b1460.
[S][3.377] Shared timer type 6 not running: inp=0x55b3f68af840, stcb=0x55b3f68b0910, net=0x55b3f68b1460.
[S][3.377] Shared timer type 9 not running: inp=0x55b3f68af840, stcb=0x55b3f68b0910, net=0x55b3f68b1460.
[S][3.377] Timer type 8 not stopped: inp=0x55b3f68af840, stcb=0x55b3f68b0910, net=0x55b3f68b1460.
[S][3.377] Timer type 5 not stopped: inp=0x55b3f68af840, stcb=0x55b3f68b0910, net=0x55b3f68b1460.
[S][3.377] Timer type 1 not stopped: inp=0x55b3f68af840, stcb=0x55b3f68b0910, net=0x7fad5404b200.
[S][3.377] Timer type 2 not stopped: inp=0x55b3f68af840, stcb=0x55b3f68b0910, net=0x7fad5404b200.
[S][3.377] Timer type 4 not stopped: inp=0x55b3f68af840, stcb=0x55b3f68b0910, net=0x7fad5404b200.
[S][3.377] Timer type 6 not stopped: inp=0x55b3f68af840, stcb=0x55b3f68b0910, net=0x7fad5404b200.
[S][3.377] Timer type 9 not stopped: inp=0x55b3f68af840, stcb=0x55b3f68b0910, net=0x7fad5404b200.
[S][3.377] Timer type 8 not stopped: inp=0x55b3f68af840, stcb=0x55b3f68b0910, net=0x7fad5404b200.
[S][3.377] Timer type 5 not stopped: inp=0x55b3f68af840, stcb=0x55b3f68b0910, net=0x7fad5404b200.
[S][3.377] Timer type 3 not stopped: inp=0x55b3f68af840, stcb=0x55b3f68b0910, net=(nil).
[S][3.377] Timer type 13 not stopped: inp=0x55b3f68af840, stcb=0x55b3f68b0910, net=(nil).
[S][3.377] Timer type 15 not stopped: inp=0x55b3f68af840, stcb=0x55b3f68b0910, net=(nil).
[S][3.377] Timer type 10 not stopped: inp=0x55b3f68af840, stcb=0x55b3f68b0910, net=(nil).
[S][3.377] Timer type 12 not stopped: inp=0x55b3f68af840, stcb=0x55b3f68b0910, net=(nil).
[S][3.377] Timer type 11 not stopped: inp=0x55b3f68af840, stcb=0x55b3f68b0910, net=(nil).
[S][3.377] Timer type 17 not stopped: inp=0x55b3f68af840, stcb=0x55b3f68b0910, net=(nil).
[S][3.377] Shared timer type 1 not running: inp=0x55b3f68af840, stcb=0x55b3f68b0910, net=0x55b3f68b1460.
[S][3.377] Shared timer type 2 not running: inp=0x55b3f68af840, stcb=0x55b3f68b0910, net=0x55b3f68b1460.
[S][3.377] Timer type 4 not stopped: inp=0x55b3f68af840, stcb=0x55b3f68b0910, net=0x55b3f68b1460.
[S][3.377] Shared timer type 6 not running: inp=0x55b3f68af840, stcb=0x55b3f68b0910, net=0x55b3f68b1460.
[S][3.377] Shared timer type 9 not running: inp=0x55b3f68af840, stcb=0x55b3f68b0910, net=0x55b3f68b1460.
[S][3.377] Timer type 8 not stopped: inp=0x55b3f68af840, stcb=0x55b3f68b0910, net=0x55b3f68b1460.
[S][3.377] Timer type 5 not stopped: inp=0x55b3f68af840, stcb=0x55b3f68b0910, net=0x55b3f68b1460.
[S][3.377] Timer type 1 not stopped: inp=0x55b3f68af840, stcb=0x55b3f68b0910, net=0x7fad5404b200.
[S][3.377] Timer type 2 not stopped: inp=0x55b3f68af840, stcb=0x55b3f68b0910, net=0x7fad5404b200.
[S][3.377] Timer type 4 not stopped: inp=0x55b3f68af840, stcb=0x55b3f68b0910, net=0x7fad5404b200.
[S][3.377] Timer type 6 not stopped: inp=0x55b3f68af840, stcb=0x55b3f68b0910, net=0x7fad5404b200.
[S][3.377] Timer type 9 not stopped: inp=0x55b3f68af840, stcb=0x55b3f68b0910, net=0x7fad5404b200.
[S][3.377] Timer type 8 not stopped: inp=0x55b3f68af840, stcb=0x55b3f68b0910, net=0x7fad5404b200.
[S][3.377] Timer type 5 not stopped: inp=0x55b3f68af840, stcb=0x55b3f68b0910, net=0x7fad5404b200.
[S][3.377] Timer type 7 stopped: inp=0x55b3f68af840, stcb=(nil), net=(nil).
Number of packets (sent/received): (6/4).
```

tcpdump:
```
09:26:29.328735 IP 192.168.101.65.65464 > 192.168.101.67.7: sctp (1) [INIT] [init tag: 673387795] [rwnd: 131072] [OS: 10] [MIS: 2048] [init TSN: 909228828]
09:26:29.328998 IP 192.168.101.67.7 > 192.168.101.65.65464: sctp (1) [INIT ACK] [init tag: 2406548352] [rwnd: 131072] [OS: 10] [MIS: 2048] [init TSN: 1901385287]
09:26:29.332780 IP 192.168.101.65.65464 > 192.168.101.67.7: sctp (1) [COOKIE ECHO]
09:26:29.332953 IP 192.168.101.67.7 > 192.168.101.65.65464: sctp (1) [COOKIE ACK]
09:26:29.333009 IP 192.168.101.67.7 > 192.168.101.66.65464: sctp (1) [HB REQ]
09:26:29.334297 IP 192.168.101.65.65464 > 192.168.101.67.7: sctp (1) [HB ACK]
09:26:32.702951 IP 192.168.101.65.65464 > 192.168.101.67.7: sctp (1) [SHUTDOWN]
09:26:32.703176 IP 192.168.101.67.7 > 192.168.101.65.65464: sctp (1) [SHUTDOWN ACK]
09:26:32.703318 IP 192.168.101.65.65464 > 192.168.101.67.7: sctp (1) [SHUTDOWN COMPLETE]
```
As I can see, bind is completely ignored and packets are sent from another IP.

I've also tried setting `usrsctp_sysctl_set_sctp_auto_asconf(0);` but it also didn't change anything.

Can anybody tell how to disable automatic IP announcements and how to use bind properly?

**Comment by ashish-billore** [comment]
You may try using bindx to control the IPs to be used, by adding or removing the IPs. Something like:

	memset((void *)&addr, 0, sizeof(struct sockaddr_in6));
	addr.sin_family = AF_INET;
	addr.sin_port = htons(PORT);
	addr.sin_addr.s_addr = inet_addr(<SPECIFIC_IP>);


	if (usrsctp_bindx(sock, (struct sockaddr *)&addr, 1, SCTP_BINDX_ADD_ADDR) < 0) {
		perror("usrsctp_bindx");
	}

**Comment by tuexen** [comment]
The problem with the above code is that you use a `sruct sockaddr_in6` to handle an IPv4 address. This results in the SCTP seeing 0.0.0.0 as the address you provided, which means "all available addresses".

Try:
```
	usrsctp_init(0, NULL, debug_printf_stack);
	usrsctp_sysctl_set_sctp_debug_on(0x7ff3ffff);
	usrsctp_sysctl_set_sctp_auto_asconf(0);

	if ((sock = usrsctp_socket(AF_INET, SOCK_STREAM, IPPROTO_SCTP, NULL, NULL, 0, NULL)) == NULL) {
		perror("usrsctp_socket");
	}

	memset((void *)&addr4, 0, sizeof(struct sockaddr_in));
	addr4.sin_family = AF_INET;
	addr4.sin_port = htons(atoi(argv[2]));

	struct sockaddr_in local_sockaddr;
	memset((void *)&local_sockaddr, 0, sizeof(struct sockaddr_in));
	local_sockaddr.sin_family = AF_INET;
	inet_pton(AF_INET, "192.168.101.66", &local_sockaddr.sin_addr);
	int returned;
	returned = usrsctp_bind(sock, (struct sockaddr *)&local_sockaddr, sizeof(local_sockaddr));
	printf("bind:%i\n", returned);

	if (inet_pton(AF_INET, argv[1], &addr4.sin_addr) == 1) {
		if (usrsctp_connect(sock, (struct sockaddr *)&addr4, sizeof(struct sockaddr_in)) < 0) {
			perror("usrsctp_connect");
		}
	} else {
		printf("Illegal destination address.\n");
	}
	[...]
```

**Comment by cukiernick** [comment]
Yup, `sockaddr_in` solved the issue. I had a wrong assumption that `sockaddr_in6` is compatible with IPv4 addresses.
Now I see that after casting to sockaddr_in the field `uint32_t sin6_flowinfo` would be interpreted as IPv4. 
Thanks for the answer, now it works as expected.
